{
  "version": "0.1.0",
  "status": "active",
  "source_plan": "docs/plans/datacanvas-adaptive-scrum-implementation-plan.md",
  "changelog_path": "docs/process/current/process-changelog.md",
  "entries": [
    {
      "process_change_id": "PROC-001",
      "title": "Принять процесс 0.1.0",
      "status": "accepted",
      "decision": "accept",
      "source": "docs/plans/datacanvas-adaptive-scrum-implementation-plan.md",
      "pcr_path": "docs/process/change-requests/PROC-001-accept-process-v0.1.md",
      "changelog_anchor": "PROC-001",
      "affected_artifacts": [
        "docs/process/current/process-passport.md",
        "docs/process/current/process-registry.md",
        "docs/process/current/process-changelog.md"
      ],
      "validation_commands": [
        "npm run validate:bootstrap"
      ],
      "migration_notes": "Первая версия процесса; миграция не требуется.",
      "rollback": "До первого принятого Sprint Review можно удалить bootstrap process artifacts."
    },
    {
      "process_change_id": "PROC-035",
      "title": "Сделать threat-model-delta coverage обязательным gate",
      "status": "accepted",
      "decision": "accept",
      "source": "docs/sprints/2026-W26-threat-model-delta-governance/process-change-candidates.md",
      "pcr_path": "docs/process/change-requests/PROC-035-threat-model-delta-governance.md",
      "changelog_anchor": "PROC-035",
      "affected_artifacts": [
        "docs/architecture/security/threat-model-delta-manifest.json",
        "schemas/threat-model-delta-manifest.schema.json",
        "scripts/validate-threat-model-delta.mjs",
        ".github/workflows/docs-check.yml",
        "package.json"
      ],
      "validation_commands": [
        "npm run validate:threat-model-delta",
        "npm run validate:bootstrap",
        "npm test"
      ],
      "migration_notes": "Все существующие sprint folders получили coverage entry в manifest. Новый sprint folder обязан добавляться в manifest до закрытия Sprint Review.",
      "rollback": "Удалить gate из npm test/CI, вернуть section 9 plan coverage в partial и оставить S21 explicit threat-model-delta как единственный обязательный artifact."
    },
    {
      "process_change_id": "PROC-036",
      "title": "Закрепить business-first navigation governance",
      "status": "accepted",
      "decision": "accept",
      "source": "docs/plans/datacanvas-business-technical-navigation-separation-implementation-plan.md",
      "pcr_path": "docs/process/change-requests/PROC-036-documentation-navigation-governance.md",
      "changelog_anchor": "PROC-036",
      "affected_artifacts": [
        "README.md",
        "docs/README.md",
        "docs/product/README.md",
        "docs/navigation/navigation-source.json",
        "schemas/docs-navigation-source.schema.json",
        "schemas/docs-navigation-index.schema.json",
        "scripts/generate-docs-navigation.mjs",
        "scripts/validate-docs-navigation.mjs",
        "docs/process/current/process-registry.md",
        "docs/process/current/definition-of-ready.md",
        "docs/process/current/definition-of-done.md",
        ".github/PULL_REQUEST_TEMPLATE.md",
        "AGENTS.md"
      ],
      "validation_commands": [
        "npm run generate:docs-navigation",
        "npm run check:docs-navigation",
        "npm run validate:docs-navigation",
        "npm run validate:artifact-registry",
        "npm run validate:artifact-hashes",
        "npm run validate:process-change-ledger",
        "npm test"
      ],
      "migration_notes": "Business-first routes, navigation_group contract, grouped generated navigation and business artifact registry entries are synchronized in one implementation PR.",
      "rollback": "Revert navigation source, schemas, generator, validator, registry, generated outputs and business-first README changes, then rerun docs navigation, artifact and security gates."
    },
    {
      "process_change_id": "PROC-037",
      "title": "Ввести governed BA/SA discovery-to-refinement loop",
      "status": "draft",
      "decision": "not_decided",
      "source": "docs/plans/datacanvas-ba-sa-interview-change-order-implementation-plan.md",
      "pcr_path": "docs/process/change-requests/PROC-037-governed-ba-sa-discovery-loop.md",
      "changelog_anchor": "PROC-037",
      "affected_artifacts": [
        "docs/process/current/definition-of-ready.md",
        "docs/process/current/definition-of-done.md",
        "docs/process/current/process-event-log.json",
        "scripts/validate-process-event-log.mjs",
        "scripts/validate-ba-sa-artifacts.mjs",
        "package.json",
        ".github/PULL_REQUEST_TEMPLATE.md"
      ],
      "validation_commands": [
        "npm run validate:ba-sa",
        "npm run validate:process-events",
        "npm test"
      ],
      "migration_notes": "Draft process rule is documented and wired to validators, but it does not become accepted process policy until Process Owner decision.",
      "rollback": "Revert DoR/DoD/process event additions and remove BA/SA gates from npm test."
    },
    {
      "process_change_id": "PROC-038",
      "title": "Ввести cascading documentation governance",
      "status": "draft",
      "decision": "not_decided",
      "source": "docs/plans/datacanvas-cascading-documentation-governance-plan.md",
      "pcr_path": "docs/process/change-requests/PROC-038-cascading-documentation-governance.md",
      "changelog_anchor": "PROC-038",
      "affected_artifacts": [
        "docs/process/cascading-governance/README.md",
        "docs/process/current/definition-of-ready.md",
        "docs/process/current/definition-of-done.md",
        "docs/process/current/process-passport.md",
        "scripts/validate-cascading-governance.mjs",
        "scripts/run-cascading-update.mjs",
        "package.json"
      ],
      "validation_commands": [
        "npm run validate:cascading-governance",
        "npm run validate:schemas",
        "npm run validate:docs-navigation",
        "npm run validate:artifact-registry",
        "npm run validate:artifact-hashes",
        "npm test"
      ],
      "migration_notes": "Draft cascade rule is documented and wired to validators. It does not invent capacity, priorities, dates, scope, regulations or Jira mapping; unresolved values remain pending_external or blocking decisions.",
      "rollback": "Revert cascade schemas, validators, source artifacts, fixtures, DoR/DoD/passport additions, navigation source and artifact registry entries, then regenerate navigation/hash artifacts."
    },
    {
      "process_change_id": "PROC-046",
      "title": "Ввести сохраняемое состояние PO-опросника",
      "status": "accepted",
      "decision": "accept",
      "source": "docs/product/change-orders/co-2026-001-acceptance-questionnaire-log.md",
      "pcr_path": "docs/process/change-requests/PROC-046-product-change-questionnaire-state.md",
      "changelog_anchor": "PROC-046",
      "affected_artifacts": [
        "AGENTS.md",
        "docs/process/methodology/project-documentation-methodology.md",
        "docs/product/change-orders/product-change-questionnaire-protocol.md",
        "schemas/product-change-questionnaire-state.schema.json",
        "scripts/validate-product-change-questionnaire-state.mjs",
        "package.json"
      ],
      "validation_commands": [
        "npm run validate:co-questionnaire",
        "npm run validate:documentation-methodology",
        "npm run validate:process-change-ledger"
      ],
      "migration_notes": "Для CO-2026-001 создано активное состояние и журнал; продолжение опросника выполняется с PRODUCT-21.",
      "rollback": "Пометить questionnaire artifacts как superseded и удалить validate:co-questionnaire из промежуточных validation plans; продуктовые решения не откатываются без отдельного решения Product Owner."
    },
    {
      "process_change_id": "PROC-048",
      "title": "Закрепить CLI-friendly форматирование таблиц",
      "status": "accepted",
      "decision": "accept",
      "source": "docs/process/audits/codex-cli-table-output-process-audit.md",
      "pcr_path": "docs/process/change-requests/PROC-048-cli-table-output.md",
      "changelog_anchor": "PROC-048",
      "affected_artifacts": [
        "AGENTS.md",
        "docs/process/universal-documentation-workflow/README.md",
        "docs/process/universal-documentation-workflow/universal-workflow-runbook.md",
        "docs/process/universal-documentation-workflow/universal-workflow-core.json",
        "docs/process/audits/codex-cli-table-output-process-audit.md",
        "scripts/validate-universal-documentation-workflow.mjs"
      ],
      "validation_commands": [
        "npm run validate:universal-documentation-workflow",
        "npm run validate:process-change-ledger",
        "npm run validate:docs-navigation",
        "npm run validate:artifact-registry",
        "npm run validate:artifact-hashes",
        "npm test"
      ],
      "migration_notes": "Правило применяется только к рабочему чату Codex и процессным инструкциям. Продуктовые backlog, stories, requirements, BMC и Vision DataCanvas не меняются.",
      "rollback": "Вернуть PROC-048 в Draft, удалить правило cli-table-output из AGENTS.md и UDW-инструкций, убрать проверку из validate-universal-documentation-workflow, затем регенерировать navigation, hash manifest и process metrics snapshot."
    },
    {
      "process_change_id": "PROC-062",
      "title": "Защитить XLSX-источник и историю Git",
      "status": "accepted",
      "decision": "accept",
      "source": "docs/process/change-requests/PROC-062-xlsx-source-history-hygiene.md",
      "pcr_path": "docs/process/change-requests/PROC-062-xlsx-source-history-hygiene.md",
      "changelog_anchor": "PROC-062",
      "affected_artifacts": [
        "AGENTS.md",
        ".gitignore",
        ".github/workflows/docs-check.yml",
        "docs/product/sources/product-source-registry.json",
        "docs/product/sources/source-audit.md",